StartDate,EndDate,Status,IPAddress,Progress,Duration (in seconds),Finished,RecordedDate,RecipientLastName,RecipientFirstName,RecipientEmail,ExternalReference,LocationLatitude,LocationLongitude,DistributionChannel,UserLanguage,Q2.1,Q2.2,Q135,Q2.8,Q2.7,Q130_1,Q130_2,Q130_8,Q130_4,Q130_3,Q130_5,Q130_6,Q130_7,Q130_6_TEXT,Q134,Q2.3,Q2.9,Q138,Q2.4,Q2.5_1,Q2.5_2,Q2.5_3,Q2.5_4,Q2.6,Q3.1,Q3.2_4,Q3.2_5,Q3.4,Q3.5,Q3.6,Q3.9,Q3.7_1,Q3.7_2,Q3.7_3,Q3.8,Q4.1_1,Q4.2,Q4.3,Q4.4_1,Q4.5,Q4.7,Q4.8,Q4.8_DO_1,Q4.8_DO_2,Q4.8_DO_3,Q4.8_DO_4,Q4.8_DO_5,Q146_First Click,Q146_Last Click,Q146_Page Submit,Q146_Click Count,Q5.1,Q145_First Click,Q145_Last Click,Q145_Page Submit,Q145_Click Count,Q6.1,Q144_First Click,Q144_Last Click,Q144_Page Submit,Q144_Click Count,Q7.1,Q8.1,Q8.2,Q8.3_1,Q8.3_2,Q8.3_3,Q8.4_1,Q8.4_2,Q8.4_3,Q8.4_4,Q8.4_5,Q8.4_6,Q8.4_7,Q8.4_9,Q8.4_DO_1,Q8.4_DO_2,Q8.4_DO_3,Q8.4_DO_4,Q8.4_DO_5,Q8.4_DO_6,Q8.4_DO_7,Q8.4_DO_9,Q8.5,Q8.5_DO_1,Q8.5_DO_2,Q8.5_DO_9,Q8.5_DO_4,Q8.5_DO_5,Q8.5_DO_6,Q8.6,Q8.7_1,Q8.7_2,Q8.7_3,Q8.7_4,Q8.7_5,Q8.7_6,Q8.8,Q8.9_1,Q8.9_2,Q8.9_3,Q8.9_4,Q8.9_5,Q8.9_6,Q8.9_7,Q8.9_8,Q8.9_9,Q8.10_1,Q8.10_2,Q8.10_3,Q8.10_4,Q8.11_1,Q8.11_2,Q8.11_3,Q8.11_10,Q8.11_4,Q8.11_8,Q8.11_9,Q8.11_5,Q8.11_9_TEXT,Q147_First Click,Q147_Last Click,Q147_Page Submit,Q147_Click Count,Q9.1_1,Q9.1_2,Q9.1_3,Q9.1_4,Q9.1_5,Q9.2_1,Q9.2_2,Q9.2_3,Q9.2_4,Q9.2_5,Q9.3,Q9.4,Q137,Q9.5,Q9.6,Q9.7,Q140_First Click,Q140_Last Click,Q140_Page Submit,Q140_Click Count,Q141_First Click,Q141_Last Click,Q141_Page Submit,Q141_Click Count,Q12.2,Q12.3,Q12.4,Q12.5,Q12.6,Q12.7_1,Q12.7_2,Q12.7_3,Q12.7_4,Q12.7_5,Q12.8,Q12.9,Q13.2,Q13.3,Q13.4,Q13.5,Q13.6_1,Q13.6_2,Q13.6_3,Q13.6_4,Q13.6_5,Q13.7,Q13.8,Q142_First Click,Q142_Last Click,Q142_Page Submit,Q142_Click Count,Q14.2,Q14.3,Q14.4,Q14.5,Q14.6_1,Q14.6_2,Q14.6_3,Q14.6_4,Q14.6_5,Q14.7,Q14.8,Q143_First Click,Q143_Last Click,Q143_Page Submit,Q143_Click Count,Q15.1,Q15.2_1,Q15.2_2,Q15.2_3,Q15.2_4,Q15.2_5,Q15.2_6,Q15.2_DO_1,Q15.2_DO_2,Q15.2_DO_3,Q15.2_DO_4,Q15.2_DO_5,Q15.2_DO_6,Q15.3_1,Q15.3_2,Q15.3_3,Q15.3_4,Q15.3_5,Q15.3_6,Q15.3_7,Q15.3_8,Q15.3_9,Q15.3_10,Q15.3_10_TEXT,Q15.3_DO_1,Q15.3_DO_2,Q15.3_DO_3,Q15.3_DO_4,Q15.3_DO_5,Q15.3_DO_6,Q15.3_DO_7,Q15.3_DO_8,Q15.3_DO_9,Q15.3_DO_10,Q16.1,Q16.2,Q16.3,Q16.4,Q16.5_1,Q16.5_2,Q16.5_3,Q16.5_4,Q16.5_5,Q16.5_DO_1,Q16.5_DO_2,Q16.5_DO_3,Q16.5_DO_4,Q16.5_DO_5,Q16.6,Q17.1,Q18.1,Q148,Q18.2,Q18.3_1,Q18.3_2,Q18.3_3,Q18.3_4,Q18.3_5,Q18.3_6,Q18.3_7,Q18.3_8,Q18.3_9,Q18.3_10,Q18.3_11,Q18.3_13,Q18.3_12,Q18.3_12_TEXT,Q18.4,Q18.5,Q18.6,Q18.6_6_TEXT,Q19.1,Q19.2,Q_Language,Finished_1,Q_TerminateFlag,Q_TotalDuration,urban_category,treatment_policy,treatment_climate,Preferenceforbansvs.incentives_DO_Q16.5,Preferenceforbansvs.incentives_DO_Q16.4,Preferenceforbansvs.incentives_DO_Q16.2,Preferenceforbansvs.incentives_DO_Q16.3,Preferenceforbansvs.incentives_DO_Q16.1,Preferenceforbansvs.incentives_DO_Q16.6
Start Date,End Date,Response Type,IP Address,Progress,Duration (in seconds),Finished,Recorded Date,Recipient Last Name,Recipient First Name,Recipient Email,External Data Reference,Location Latitude,Location Longitude,Distribution Channel,User Language,What is your gender?,How old are you?,In which part of the United States do you live?,What is your zipcode?,Do you live in a rural or an urban area? I live in:,What race or ethnicity do you identify with? (Several answers possible) - Selected Choice - White,What race or ethnicity do you identify with? (Several answers possible) - Selected Choice - Black or African American,What race or ethnicity do you identify with? (Several answers possible) - Selected Choice - Hispanic,What race or ethnicity do you identify with? (Several answers possible) - Selected Choice - Asian,What race or ethnicity do you identify with? (Several answers possible) - Selected Choice - American Indian or Alaskan Native,What race or ethnicity do you identify with? (Several answers possible) - Selected Choice - Native Hawaiian or Pacific Islander,What race or ethnicity do you identify with? (Several answers possible) - Selected Choice - Other,What race or ethnicity do you identify with? (Several answers possible) - Selected Choice - Prefer not to say,What race or ethnicity do you identify with? (Several answers possible) - Other - Text,How well can you speak English?,What is the highest level of education you have completed?,What is your employment status?,Have you or a member of your household been laid off or had to take a cut in pay due to the COVID pandemic?,"What was the annual income of your household in 2019 (before withholding tax, for you and those who live with you)?",Are you a homeowner or a tenant? (Multiple answers are possible) - Tenant,Are you a homeowner or a tenant? (Multiple answers are possible) - Owner,Are you a homeowner or a tenant? (Multiple answers are possible) - Landlord renting out property,Are you a homeowner or a tenant? (Multiple answers are possible) - Hosted free of charge,"What
is the estimated value of your assets, or those of your household if you are married (in US dollars)? 
















Include here are all your possessions (home, car, savings, etc.) net of debt. For example, if you own a house worth $300,000 and you have $100,000 left to pay back on your mortgage, your assets are $200,000.
I estimate my assets net of debt to be:",How many children do you have?,"How many people are in your household? The household includes: you, the members of your family who live with you, and your dependents. - Above 18","How many people are in your household? The household includes: you, the members of your family who live with you, and your dependents. - Below 18",What is the main way you heat your home?,How many miles have you and your household members driven in 2019?,How many round-trip flights did you take between 2015 and 2019 (included)?,How often do you eat beef?,"Which mode of transport did you mainly use for each of the following trips in 2019? - Going to work, school/university",Which mode of transport did you mainly use for each of the following trips in 2019? - Grocery shopping,Which mode of transport did you mainly use for each of the following trips in 2019? - Leisure (excluding holidays),Is public transport available where you live?,"Generally speaking, would you say that most people can be trusted or that you need to be very careful? - People can be trusted",How much of the time do you think you can trust the US government to do what is right?,Do you agree or disagree that authorities spend the revenue obtained from taxes and fees in a sensible way?,"Think more broadly about the purpose of the government. Where would you rate yourself on a scale of 1 to 5, where 1 means you think the government should do only those things necessary to provide the most basic government functions (e.g. ensure public order and enforce the law, protect against foreign threats, set basic rules for a free market economy), and 5 means you think the government should take active steps in every area it can to try and improve the lives of its citizens (e.g. provide a welfare state that distributes income from the rich to the poor, provides public goods such as hospitals and schools, sets boundaries to the market economy, etc.) . - Government should play an active role",Do you think inequality is a serious problem in the United States?,Where do you see the world in 100 years?,Which of the following statements is closest to your view on environmental issues?,"Which of the following statements is closest to your view on environmental issues? - Display Order - Our civilization will eventually collapse, it is useless to try making society more sustainable",Which of the following statements is closest to your view on environmental issues? - Display Order - Our civilization will develop so much that environmental issues will not be a problem in the distant future,Which of the following statements is closest to your view on environmental issues? - Display Order - We should make our society as sustainable as possible to avoid irreversible damages,Which of the following statements is closest to your view on environmental issues? - Display Order - I believe we have more important goals than sustainability,"Which of the following statements is closest to your view on environmental issues? - Display Order - Don't know, or prefer not to say",Timing - First Click,Timing - Last Click,Timing - Page Submit,Timing - Click Count,What are your political views? What political proposals do you support?,Timing - First Click,Timing - Last Click,Timing - Page Submit,Timing - Click Count,What do you know about climate change? What are your views on climate change?,Timing - First Click,Timing - Last Click,Timing - Page Submit,Timing - Click Count,"Do you think the US government should fight climate change? If yes, how?","In your opinion, climate change...",Which of the following statements is true? If we halve global greenhouse gas emissions...,"In your opinion, which of the following statements are true? (Multiple answers are possible. Note that by ""far more"", we mean at least ten times more.) - Eating one beef steak emits far more greenhouse gases than eating two servings of pasta","In your opinion, which of the following statements are true? (Multiple answers are possible. Note that by ""far more"", we mean at least ten times more.) - Electricity produced by nuclear power emits far more greenhouse gases than electricity produced by wind turbines","In your opinion, which of the following statements are true? (Multiple answers are possible. Note that by ""far more"", we mean at least ten times more.) - Commuting by car emits far more greenhouse gases than food waste","In your opinion, which of the following is predominantly responsible for climate change? (Multiple answers are possible) - Each of us","In your opinion, which of the following is predominantly responsible for climate change? (Multiple answers are possible) - The rich","In your opinion, which of the following is predominantly responsible for climate change? (Multiple answers are possible) - Governments","In your opinion, which of the following is predominantly responsible for climate change? (Multiple answers are possible) - Companies","In your opinion, which of the following is predominantly responsible for climate change? (Multiple answers are possible) - Previous generations","In your opinion, which of the following is predominantly responsible for climate change? (Multiple answers are possible) - Some foreign countries","In your opinion, which of the following is predominantly responsible for climate change? (Multiple answers are possible) - Natural causes","In your opinion, which of the following is predominantly responsible for climate change? (Multiple answers are possible) - None of the above, climate change is not a reality","In your opinion, which of the following is predominantly responsible for climate change? (Multiple answers are possible) - Display Order - Each of us","In your opinion, which of the following is predominantly responsible for climate change? (Multiple answers are possible) - Display Order - The rich","In your opinion, which of the following is predominantly responsible for climate change? (Multiple answers are possible) - Display Order - Governments","In your opinion, which of the following is predominantly responsible for climate change? (Multiple answers are possible) - Display Order - Companies","In your opinion, which of the following is predominantly responsible for climate change? (Multiple answers are possible) - Display Order - Previous generations","In your opinion, which of the following is predominantly responsible for climate change? (Multiple answers are possible) - Display Order - Some foreign countries","In your opinion, which of the following is predominantly responsible for climate change? (Multiple answers are possible) - Display Order - Natural causes","In your opinion, which of the following is predominantly responsible for climate change? (Multiple answers are possible) - Display Order - None of the above, climate change is not a reality",Do you think humanity can stop emitting greenhouse gases and halt climate change?,Do you think humanity can stop emitting greenhouse gases and halt climate change? - Display Order - Humans have no noticeable influence on the climate.,Do you think humanity can stop emitting greenhouse gases and halt climate change? - Display Order - We’d better live with climate change rather than try to halt it. Stopping emissions would cause more harm than climate change itself.,"Do you think humanity can stop emitting greenhouse gases and halt climate change? - Display Order - We should stop emissions, but unfortunately this is not going to happen.",Do you think humanity can stop emitting greenhouse gases and halt climate change? - Display Order - Ambitious policies and raising awareness will eventually succeed in stopping emissions within the next century.,Do you think humanity can stop emitting greenhouse gases and halt climate change? - Display Order - Technologies and habits are changing and this will suffice to prevent disastrous climate change. We do not need ambitious policies.,"Do you think humanity can stop emitting greenhouse gases and halt climate change? - Display Order - Don't know, or prefer not to say",How often do you talk about climate change?,"In your opinion, in your country, which generations will be seriously affected by climate change? (Multiple answers are possible) - People born in the 1960s (i.e., those currently between 50 and 60 years old)","In your opinion, in your country, which generations will be seriously affected by climate change? (Multiple answers are possible) - People born in the 1990s (i.e., those currently between 20 and 30 years old)","In your opinion, in your country, which generations will be seriously affected by climate change? (Multiple answers are possible) - People born in the 2020s","In your opinion, in your country, which generations will be seriously affected by climate change? (Multiple answers are possible) - People born in the 2050s","In your opinion, in your country, which generations will be seriously affected by climate change? (Multiple answers are possible) - None of the above","In your opinion, in your country, which generations will be seriously affected by climate change? (Multiple answers are possible) - Don't know, or prefer not to say","Imagine that all countries in the world agree on wide-reaching measures to fight climate change. This would mean a large expansion in the availability and use of non-polluting transport, a faster transition to renewable energy, and efforts from everyone according to their means. 
In such a scenario, would you be willing to adopt a sustainable lifestyle? By ""sustainable lifestyle"", we mean eat little beef and use almost no fuel (for driving, heating or flying).","Would you be willing to change your lifestyle (e.g. drive less, fly less, consume less, cycle more) to fight climate change? (Multiple answers are possible) - Yes, if policies went in this direction","Would you be willing to change your lifestyle (e.g. drive less, fly less, consume less, cycle more) to fight climate change? (Multiple answers are possible) - Yes, if I had the financial means","Would you be willing to change your lifestyle (e.g. drive less, fly less, consume less, cycle more) to fight climate change? (Multiple answers are possible) - Yes, if everyone did the same","Would you be willing to change your lifestyle (e.g. drive less, fly less, consume less, cycle more) to fight climate change? (Multiple answers are possible) - No, only the richest people should change their lifestyle","Would you be willing to change your lifestyle (e.g. drive less, fly less, consume less, cycle more) to fight climate change? (Multiple answers are possible) - No, it would affect me more to change my lifestyle than to live with climate change","Would you be willing to change your lifestyle (e.g. drive less, fly less, consume less, cycle more) to fight climate change? (Multiple answers are possible) - No, I think climate change is not a real problem","Would you be willing to change your lifestyle (e.g. drive less, fly less, consume less, cycle more) to fight climate change? (Multiple answers are possible) - I have already adopted a sustainable lifestyle","Would you be willing to change your lifestyle (e.g. drive less, fly less, consume less, cycle more) to fight climate change? (Multiple answers are possible) - I try, but I have trouble changing my habits","Would you be willing to change your lifestyle (e.g. drive less, fly less, consume less, cycle more) to fight climate change? (Multiple answers are possible) - Don't know, or prefer not to say","If we decided to halt climate change, what would be the effect on our lifestyle? The policies aimed at halting climate change ... (Multiple answers are possible) - ... would be an opportunity for our economy: it would create jobs, reduce air pollution, and improve our lifestyle","If we decided to halt climate change, what would be the effect on our lifestyle? The policies aimed at halting climate change ... (Multiple answers are possible) - ... would be costly, but we would be able to maintain our lifestyle (e.g. increasing thermal insulation of housing, replacing cars running on fossil fuels by electric cars, electricity from coal by renewables or nuclear, etc.)","If we decided to halt climate change, what would be the effect on our lifestyle? The policies aimed at halting climate change ... (Multiple answers are possible) - ... would require a deep change in our lifestyle (e.g. reducing energy consumption, eating much less meat, driving less and using public transport or cycling instead, etc.)","If we decided to halt climate change, what would be the effect on our lifestyle? The policies aimed at halting climate change ... (Multiple answers are possible) - Don't know, or prefer not to say","Which of the following issues do we need to address to halt climate change? (Multiple answers are possible) - Selected Choice - The use of technologies that emit greenhouse gases (e.g. cars running on fossil fuels, electricity from coal...)","Which of the following issues do we need to address to halt climate change? (Multiple answers are possible) - Selected Choice - The level of waste (waste of energy, waste of food, inefficiencies, etc.)",Which of the following issues do we need to address to halt climate change? (Multiple answers are possible) - Selected Choice - High standards of living,Which of the following issues do we need to address to halt climate change? (Multiple answers are possible) - Selected Choice - Overconsumption,Which of the following issues do we need to address to halt climate change? (Multiple answers are possible) - Selected Choice - Overpopulation,Which of the following issues do we need to address to halt climate change? (Multiple answers are possible) - Selected Choice - None of the above,Which of the following issues do we need to address to halt climate change? (Multiple answers are possible) - Selected Choice - Other (specify):,"Which of the following issues do we need to address to halt climate change? (Multiple answers are possible) - Selected Choice - Don't know, or prefer not to say",Which of the following issues do we need to address to halt climate change? (Multiple answers are possible) - Other (specify): - Text,Timing - First Click,Timing - Last Click,Timing - Page Submit,Timing - Click Count,At which level(s) do you think public policies to tackle climate change need to be put in place? (Multiple answers are possible) - Local,At which level(s) do you think public policies to tackle climate change need to be put in place? (Multiple answers are possible) - State,At which level(s) do you think public policies to tackle climate change need to be put in place? (Multiple answers are possible) - Federal,At which level(s) do you think public policies to tackle climate change need to be put in place? (Multiple answers are possible) - Global,"At which level(s) do you think public policies to tackle climate change need to be put in place? (Multiple answers are possible) - Don't know, or prefer not to say","To achieve a given reduction of greenhouse gas emissions globally, costly investments are needed. Ideally, how should countries bear the costs of fighting climate change? - Countries should pay in proportion to their income","To achieve a given reduction of greenhouse gas emissions globally, costly investments are needed. Ideally, how should countries bear the costs of fighting climate change? - Countries should pay in proportion to their current emissions","To achieve a given reduction of greenhouse gas emissions globally, costly investments are needed. Ideally, how should countries bear the costs of fighting climate change? - Countries should pay in proportion to their past emissions (from 1990 onwards)","To achieve a given reduction of greenhouse gas emissions globally, costly investments are needed. Ideally, how should countries bear the costs of fighting climate change? - The richest countries should pay it all, so that the poorest countries do not have to pay anything","To achieve a given reduction of greenhouse gas emissions globally, costly investments are needed. Ideally, how should countries bear the costs of fighting climate change? - The richest countries should pay even more, to help vulnerable countries face adverse consequences: vulnerable countries would then receive money instead of paying","It has been proposed that each year, each human could receive an equal allowance to emit greenhouse gases (i.e. an equal “right to pollute”). Those who pollute more would have to pay for their excess emissions while those who pollute less would receive a monetary compensation corresponding to the emissions they saved. In principle, do you agree with this proposal that would give every human the same right to pollute?",Do you think the United States should take measures to fight climate change?,You think that the United States should take measures to fight climate change. How does this depend on what other countries do?,Would you approve of establishing a global democratic assembly which role would be to take action against climate change?,Would you approve of a global tax on greenhouse gas emissions funding a global basic income of $30/month to each adult?,"Would you approve of a global tax on the top 1% to finance the development of low-income countries (e.g., access to drinking water, healthcare, education...)?",Timing - First Click,Timing - Last Click,Timing - Page Submit,Timing - Click Count,Timing - First Click,Timing - Last Click,Timing - Page Submit,Timing - Click Count,Does such a policy exist in the United States?,Could the US federal government be trusted to correctly implement an emission limit for cars?,Would an emission limit for cars be effective to fight climate change?,Would an emission limit for cars have an overall positive or negative impact on employment?,Would an emission limit for cars have positive or negative side effects overall (for example on pollution or human health)?,Would the following categories of people win or lose by an emission limit for cars? - The poorest,Would the following categories of people win or lose by an emission limit for cars? - The middle class,Would the following categories of people win or lose by an emission limit for cars? - The richest,Would the following categories of people win or lose by an emission limit for cars? - Urban dwellers,Would the following categories of people win or lose by an emission limit for cars? - Rural or those living on the outskirts of an urban area,"In your opinion, would your household win or lose financially from an emission limit for cars?",Would you support an emission limit for cars?,Could the US government be trusted to correctly implement a green infrastructure program?,Would a green infrastructure program be effective to fight climate change?,Would a green infrastructure program have an overall positive or negative impact on employment?,Would a green infrastructure program have positive or negative side effects overall (for example on pollution or human health)?,Would the following categories of people win or lose by a green infrastructure program? - The poorest,Would the following categories of people win or lose by a green infrastructure program? - The middle class,Would the following categories of people win or lose by a green infrastructure program? - The richest,Would the following categories of people win or lose by a green infrastructure program? - Urban dwellers,Would the following categories of people win or lose by a green infrastructure program? - Rural or those living on the outskirts of an urban area,Would your household win or lose financially from a green infrastructure program?,Would you support a green infrastructure program?,Timing - First Click,Timing - Last Click,Timing - Page Submit,Timing - Click Count,Could the US government be trusted to correctly implement a carbon tax with cash transfers?,Would a carbon tax with cash transfers be effective to fight climate change?,Would a carbon tax with cash transfers have an overall positive or negative impact on employment?,Would a carbon tax with cash transfers have positive or negative side effects overall (for example on pollution or human health)?,Would the following categories of people win or lose by a carbon tax with cash transfers? - The poorest,Would the following categories of people win or lose by a carbon tax with cash transfers? - The middle class,Would the following categories of people win or lose by a carbon tax with cash transfers? - The richest,Would the following categories of people win or lose by a carbon tax with cash transfers? - Urban dwellers,Would the following categories of people win or lose by a carbon tax with cash transfers? - Rural or those living on the outskirts of an urban area,Would your household win or lose financially from a carbon tax with cash transfers?,Would you support a carbon tax with cash transfers?,Timing - First Click,Timing - Last Click,Timing - Page Submit,Timing - Click Count,How worried are you about the impacts of climate change?,Would you support the following climate policies? - A tax on flying,Would you support the following climate policies? - A national tax on fossil fuels,"Would you support the following climate policies? - Required thermal renovation of buildings (e.g., better insulation)","Would you support the following climate policies? - A ban of polluting vehicles in dense areas, like city centers","Would you support the following climate policies? - Subsidies for low-carbon technologies (renewable energy, capture and storage of carbon...)",Would you support the following climate policies? - A contribution to a global climate fund to finance clean energy in low-income countries,Would you support the following climate policies? - Display Order - A tax on flying,Would you support the following climate policies? - Display Order - A national tax on fossil fuels,"Would you support the following climate policies? - Display Order - Required thermal renovation of buildings (e.g., better insulation)","Would you support the following climate policies? - Display Order - A ban of polluting vehicles in dense areas, like city centers","Would you support the following climate policies? - Display Order - Subsidies for low-carbon technologies (renewable energy, capture and storage of carbon...)",Would you support the following climate policies? - Display Order - A contribution to a global climate fund to finance clean energy in low-income countries,"Revenues from carbon taxes can be put in use in different ways. To what extent would you support introducing a carbon tax, if revenues were used to finance... - Transfers to households with no alternative to using fossil fuels","Revenues from carbon taxes can be put in use in different ways. To what extent would you support introducing a carbon tax, if revenues were used to finance... - Transfers to the poorest households","Revenues from carbon taxes can be put in use in different ways. To what extent would you support introducing a carbon tax, if revenues were used to finance... - Equal cash transfers to all households","Revenues from carbon taxes can be put in use in different ways. To what extent would you support introducing a carbon tax, if revenues were used to finance... - Tax rebates for the most affected firms","Revenues from carbon taxes can be put in use in different ways. To what extent would you support introducing a carbon tax, if revenues were used to finance... - Funding environmental infrastructure projects (public transport, cycling ways, etc.)","Revenues from carbon taxes can be put in use in different ways. To what extent would you support introducing a carbon tax, if revenues were used to finance... - Subsidizing low-carbon technologies, including renewable energy","Revenues from carbon taxes can be put in use in different ways. To what extent would you support introducing a carbon tax, if revenues were used to finance... - A reduction in the public deficit","Revenues from carbon taxes can be put in use in different ways. To what extent would you support introducing a carbon tax, if revenues were used to finance... - A reduction of corporate income tax","Revenues from carbon taxes can be put in use in different ways. To what extent would you support introducing a carbon tax, if revenues were used to finance... - A reduction of personal income tax","Revenues from carbon taxes can be put in use in different ways. To what extent would you support introducing a carbon tax, if revenues were used to finance... - Other (please specify):","Revenues from carbon taxes can be put in use in different ways. To what extent would you support introducing a carbon tax, if revenues were used to finance... - Other (please specify): - Text","Revenues from carbon taxes can be put in use in different ways. To what extent would you support introducing a carbon tax, if revenues were used to finance... - Display Order - Transfers to households with no alternative to using fossil fuels","Revenues from carbon taxes can be put in use in different ways. To what extent would you support introducing a carbon tax, if revenues were used to finance... - Display Order - Transfers to the poorest households","Revenues from carbon taxes can be put in use in different ways. To what extent would you support introducing a carbon tax, if revenues were used to finance... - Display Order - Equal cash transfers to all households","Revenues from carbon taxes can be put in use in different ways. To what extent would you support introducing a carbon tax, if revenues were used to finance... - Display Order - Tax rebates for the most affected firms","Revenues from carbon taxes can be put in use in different ways. To what extent would you support introducing a carbon tax, if revenues were used to finance... - Display Order - Funding environmental infrastructure projects (public transport, cycling ways, etc.)","Revenues from carbon taxes can be put in use in different ways. To what extent would you support introducing a carbon tax, if revenues were used to finance... - Display Order - Subsidizing low-carbon technologies, including renewable energy","Revenues from carbon taxes can be put in use in different ways. To what extent would you support introducing a carbon tax, if revenues were used to finance... - Display Order - A reduction in the public deficit","Revenues from carbon taxes can be put in use in different ways. To what extent would you support introducing a carbon tax, if revenues were used to finance... - Display Order - A reduction of corporate income tax","Revenues from carbon taxes can be put in use in different ways. To what extent would you support introducing a carbon tax, if revenues were used to finance... - Display Order - A reduction of personal income tax","Revenues from carbon taxes can be put in use in different ways. To what extent would you support introducing a carbon tax, if revenues were used to finance... - Display Order - Other (please specify):","Imagine that the US federal government subsidizes the thermal renovation (e.g., better insulation) of residential housing. Would you prefer that the renovation be:","Imagine that, in order to fight climate change, the US federal government decides to limit flights to an average of 600 miles per person per year, which is equivalent to 12,000 miles per person between now and 2040. Which of the following options would you prefer:","Imagine that, in order to fight climate change, the US federal government decides to limit flights to an average of 2,000 miles per person per year, which is equivalent to 40,000 miles per person between now and 2040. Which of the following options would you prefer:","Imagine that, in order to fight climate change, the US federal government decides to limit the number of flights to an average of one round-trip per person every two years. Which of the following options would you prefer:","Imagine that, in order to fight climate change, the US federal government decides to limit the consumption of cattle products like beef and dairy. Which of the following option(s) would you approve of? (Multiple answers are possible) - A high tax on cattle products, so that the price of beef doubles","Imagine that, in order to fight climate change, the US federal government decides to limit the consumption of cattle products like beef and dairy. Which of the following option(s) would you approve of? (Multiple answers are possible) - Subsidies on organic and local vegetables, fruits and nuts","Imagine that, in order to fight climate change, the US federal government decides to limit the consumption of cattle products like beef and dairy. Which of the following option(s) would you approve of? (Multiple answers are possible) - The removal of subsidies for cattle farming","Imagine that, in order to fight climate change, the US federal government decides to limit the consumption of cattle products like beef and dairy. Which of the following option(s) would you approve of? (Multiple answers are possible) - The ban of intensive cattle farming","Imagine that, in order to fight climate change, the US federal government decides to limit the consumption of cattle products like beef and dairy. Which of the following option(s) would you approve of? (Multiple answers are possible) - Don't know, or prefer not to say","Imagine that, in order to fight climate change, the US federal government decides to limit the consumption of cattle products like beef and dairy. Which of the following option(s) would you approve of? (Multiple answers are possible) - Display Order - A high tax on cattle products, so that the price of beef doubles","Imagine that, in order to fight climate change, the US federal government decides to limit the consumption of cattle products like beef and dairy. Which of the following option(s) would you approve of? (Multiple answers are possible) - Display Order - Subsidies on organic and local vegetables, fruits and nuts","Imagine that, in order to fight climate change, the US federal government decides to limit the consumption of cattle products like beef and dairy. Which of the following option(s) would you approve of? (Multiple answers are possible) - Display Order - The removal of subsidies for cattle farming","Imagine that, in order to fight climate change, the US federal government decides to limit the consumption of cattle products like beef and dairy. Which of the following option(s) would you approve of? (Multiple answers are possible) - Display Order - The ban of intensive cattle farming","Imagine that, in order to fight climate change, the US federal government decides to limit the consumption of cattle products like beef and dairy. Which of the following option(s) would you approve of? (Multiple answers are possible) - Display Order - Don't know, or prefer not to say","If you had to choose, which one of the following would be closest to your views?","We would like to know how much you would be willing to contribute to limit global warming to safe levels (less than 3.6 degrees Fahrenheit). To fight global warming, the US government would implement a policy package to reduce emissions, for example by discouraging emissions and investing in clean technologies (renewable energy, electric vehicles, public transport, more efficient insulation, etc.). 
The funding for these investments would need to be collected annually through an additional individual contribution for the foreseeable future. 
Think about how much, if anything, you are willing to pay before entering your decision. Assume that everyone in the US as well as citizens of other countries would be required to contribute according to their means. Please bear in mind that there may be other things that you would rather spend your money on. 
How much would you at most be willing to pay annually through an additional individual contribution to limit global warming to safe levels?""",Are you interested in politics?,Are you member of an environmental organization?,Do you have any relatives who are environmentalists?,How would you define yourself? (Multiple answers are possible) - Selected Choice - Far left,How would you define yourself? (Multiple answers are possible) - Selected Choice - Left or center-left,How would you define yourself? (Multiple answers are possible) - Selected Choice - Center,How would you define yourself? (Multiple answers are possible) - Selected Choice - Right or center-right,How would you define yourself? (Multiple answers are possible) - Selected Choice - Far right,How would you define yourself? (Multiple answers are possible) - Selected Choice - Liberal,How would you define yourself? (Multiple answers are possible) - Selected Choice - Conservative,How would you define yourself? (Multiple answers are possible) - Selected Choice - Humanist,How would you define yourself? (Multiple answers are possible) - Selected Choice - Patriot,How would you define yourself? (Multiple answers are possible) - Selected Choice - Apolitical,How would you define yourself? (Multiple answers are possible) - Selected Choice - Environmentalist,How would you define yourself? (Multiple answers are possible) - Selected Choice - Feminist,How would you define yourself? (Multiple answers are possible) - Selected Choice - Other (please specify):,How would you define yourself? (Multiple answers are possible) - Other (please specify): - Text,How do you keep yourself informed of current events? Mainly through...,Did you vote in the last US presidential election?,Which candidate did you vote for in the last presidential election? - Selected Choice,Which candidate did you vote for in the last presidential election? - Other - Text,Do you feel that this survey was biased?,"The survey is nearing completion. You can now enter any comments, thoughts or suggestions in the field below.",Q_Language,Finished,Q_TerminateFlag,Q_TotalDuration,urban_category,treatment_policy,treatment_climate,Preference for bans vs. incentives - Display Order - Q16.5,Preference for bans vs. incentives - Display Order - Q16.4,Preference for bans vs. incentives - Display Order - Q16.2,Preference for bans vs. incentives - Display Order - Q16.3,Preference for bans vs. incentives - Display Order - Q16.1,Preference for bans vs. incentives - Display Order - Q16.6
