2021-01-05 11:11:01,2021-01-05 11:38:42,IP Address,99.129.89.166,100,1661,True,2021-01-05 11:38:43,,,,,42.6678009033203125,-83.2917022705078125,anonymous,EN,Male,74,Midwest,48326,"A small town (between 5,000 and 20,000 inhabitants)",White,,,,,,,,,Native,Master's degree or above,Retired,Yes,"between $70,000 and $120,000",,Owner,,,"Between $4,000 and $120,000",2,2,0,Gas,15000,5,One to four times per week,car or motorbike,car or motorbike,car or motorbike,"Not so much, public transport is available but with many limitations",5,Only some of the time,Somewhat disagree,3,A serious problem,About as rich as now on average,We should make our society as sustainable as possible to avoid irreversible damages,2,1,4,3,5,5.6,302.847,304.927,4,"I have always been independent, but have leaned Democrat for most of my life. I have voted for Republicans occasionally, but usually for Democrats. However, the last 4 years have been so divisive, and while both sides bear some responsibility, I believe Republicans bear the overwhelming majority of responsibility, primarily because they have backed Donald Trump, the second worst thing that has ever happened to our country, after the Civil War. Thus, I have vowed to never vote for any Republican for any office ever again in my life.",3.569,3.569,37.219,1,"Climate change is real, it is primarily man-made, and it is a serious threat.",4.297,4.297,150.965,1,"Absolutely. It should re-institute most of the environmental safeguards that were rolled back or eliminated during the Trump administration, should join and enforce the Paris accord, and step up as a leader in encouraging other countries to do better environmentally, especially China.",is mainly due to human activity,"temperatures will continue to rise, just more slowly",,,Commuting by car emits far more greenhouse gases than food waste,Each of us,,Governments,Companies,,Some foreign countries,,,2,4,3,7,1,5,6,8,Ambitious policies and raising awareness will eventually succeed in stopping emissions within the next century.,5,4,3,1,2,6,Almost never,,"People born in the 1990s (i.e., those currently between 20 and 30 years old)",People born in the 2020s,People born in the 2050s,,,"Don't know, or prefer not to say",,,,,,,I have already adopted a sustainable lifestyle,,,"... would be an opportunity for our economy: it would create jobs, reduce air pollution, and improve our lifestyle","... would be costly, but we would be able to maintain our lifestyle (e.g. increasing thermal insulation of housing, replacing cars running on fossil fuels by electric cars, electricity from coal by renewables or nuclear, etc.)","... would require a deep change in our lifestyle (e.g. reducing energy consumption, eating much less meat, driving less and using public transport or cycling instead, etc.)",,"The use of technologies that emit greenhouse gases (e.g. cars running on fossil fuels, electricity from coal...)","The level of waste (waste of energy, waste of food, inefficiencies, etc.)",,Overconsumption,,,,,,5.609,148.562,149.955,15,Local,State,Federal,Global,,Neither agree nor disagree,Somewhat agree,Neither agree nor disagree,Somewhat disagree,Neither agree nor disagree,"No, rights to pollute should not be defined at the individual level but at another level, for example at the country level",Yes,The US should take even more ambitious measures if other countries also take similar measures,"Don't know, or prefer not to say","Don't know, or prefer not to say","Don't know, or prefer not to say",,,,,,,,,No,No,Yes,No notable impact,Positive side effects,Would not be severely affected,Would lose,Would lose,Would lose,Would lose,Lose,Yes,No,"Don't know, or prefer not to say","Don't know,  or prefer not to say",Positive side effects,"Don't know, or prefer not to say","Don't know, or prefer not to say","Don't know, or prefer not to say","Don't know, or prefer not to say","Don't know, or prefer not to say","Don't know, or prefer not to say","Don't know, or prefer not to say",10.338,37.533,38.868,12,No,"Don't know, or prefer not to say","Don't know, or prefer not to say","Don't know, or prefer not to say","Don't know, or prefer not to say","Don't know, or prefer not to say","Don't know, or prefer not to say","Don't know, or prefer not to say","Don't know, or prefer not to say","Don't know, or prefer not to say","Don't know, or prefer not to say",5.219,93.328,95.116,17,Worried,"No, not really",Indifferent,"Yes, somewhat","Yes, somewhat","Yes, somewhat",Indifferent,2,3,6,5,1,4,Indifferent,Indifferent,Don't know,Don't know,Strongly support,Rather support,Rather support,Rather oppose,Rather support,Don't know,,7,6,1,2,5,3,4,9,10,8,Voluntary: an owner should be able to not renovate their house,,,"Don't know, or prefer not to say",,,,,"Don't know, or prefer not to say",3,2,1,4,5,"Governments should only encourage people to protect the environment, even if it means people do not always do the right thing",$ 500 per year,A lot,No,No,,Left or center-left,,,,,,Humanist,Patriot,,,,,,TV (mostly public broadcasting channels),Yes,Biden,,"No, I do not feel it was biased",,EN,1,,1661,"1",0,0,3,2,,,1,4
2021-01-05 11:01:03,2021-01-05 11:55:32,IP Address,205.220.215.1,100,3269,True,2021-01-05 11:55:33,,,,,48.2444000244140625,-116.2794952392578125,anonymous,EN,Male,72,West,83836,A rural area,White,,,,,,,,,Native,High school,Retired,No,"between $35,000 and $70,000",,,,Hosted free of charge,"Between $4,000 and $120,000",2,2,0,Electricity,5000,10,Less than once a week,,car or motorbike,car or motorbike,"No, there is no public transport",3,Never,Strongly disagree,3,A problem,"Don't know, or prefer not to say",We should make our society as sustainable as possible to avoid irreversible damages,1,2,3,4,5,3.999,3.999,185.986,1,"We need to elect leaders who have the best interest of the majority population as their top priority, not their own financial interests.
Short term stimulus payments as proposed to be $2000 per individual earning less than $75k per annum.",4.657,4.657,126.178,1,"It is a real problem to which human activities are aggravating to some unknown degree.
We should do whatever we reasonably can to reduce the human activity portion of that effect.",5.481,5.481,65.556,1,"Yes.
Get off fossil fuels and enact clean technologies across the board.",is mainly due to natural climate variability,"temperatures will continue to rise, just more slowly",Eating one beef steak emits far more greenhouse gases than eating two servings of pasta,Electricity produced by nuclear power emits far more greenhouse gases than electricity produced by wind turbines,Commuting by car emits far more greenhouse gases than food waste,Each of us,The rich,Governments,Companies,,Some foreign countries,,,4,7,1,2,5,3,6,8,"We should stop emissions, but unfortunately this is not going to happen.",1,2,5,4,3,6,Several times a year,,"People born in the 1990s (i.e., those currently between 20 and 30 years old)",People born in the 2020s,People born in the 2050s,,,Yes,"Yes, if policies went in this direction","Yes, if I had the financial means","Yes, if everyone did the same",,,,,,,"... would be an opportunity for our economy: it would create jobs, reduce air pollution, and improve our lifestyle",,,,"The use of technologies that emit greenhouse gases (e.g. cars running on fossil fuels, electricity from coal...)",,,Overconsumption,Overpopulation,,,,,8.167,126.471,128.254,20,Local,State,Federal,Global,,Neither agree nor disagree,Somewhat agree,Somewhat agree,Neither agree nor disagree,Somewhat agree,"No, rights to pollute should not be defined at the individual level but at another level, for example at the country level",Yes,The US should take even more ambitious measures if other countries are less ambitious,Yes,Yes,Yes,,,,,,,,,"Don't know, or prefer not to say",No,"Don't know, or prefer not to say","Don't know, or prefer not to say",Positive side effects,Would lose,Would lose,Would win,Would not be severely affected,Would lose,"Don't know, or prefer not to say",Yes,No,"Don't know, or prefer not to say",Positive impacts,Positive side effects,Would lose,Would lose,Would win,Would not be severely affected,Would lose,"Don't know, or prefer not to say",Yes,9.112,46.069,50.041,12,No,"Don't know, or prefer not to say","Don't know, or prefer not to say","Don't know, or prefer not to say",Would lose,Would lose,Would win,"Don't know, or prefer not to say","Don't know, or prefer not to say","Don't know, or prefer not to say","Don't know, or prefer not to say",4.966,79.474,82.536,19,Very worried,"Don't know, or prefer not to say","Don't know, or prefer not to say","Yes, somewhat","Yes, somewhat","Don't know, or prefer not to say","Yes, somewhat",5,2,4,3,1,6,Indifferent,Indifferent,Indifferent,Indifferent,Indifferent,Indifferent,Indifferent,Indifferent,Indifferent,Indifferent,,7,4,3,5,1,6,2,9,10,8,"Don't know, or prefer not to say","Don't know, or prefer not to say",,,"A high tax on cattle products, so that the price of beef doubles","Subsidies on organic and local vegetables, fruits and nuts",The removal of subsidies for cattle farming,The ban of intensive cattle farming,,2,3,1,4,5,"Don't know, or prefer not to say",$ 50 per year,A lot,No,No,,Left or center-left,,,,,,,,,,,,,TV (mostly private channels),Yes,Biden,,"No, I do not feel it was biased",,EN,1,,3269,"4",0,0,3,,2,,1,4
2021-01-05 11:10:59,2021-01-05 12:31:01,IP Address,96.230.9.134,100,4802,True,2021-01-05 12:31:02,,,,,42.0214996337890625,-71.21880340576171875,anonymous,EN,Male,75,Northeast,02035,"A small town (between 5,000 and 20,000 inhabitants)",White,,,,,,,,,Native,Master's degree or above,Retired,No,"between $35,000 and $70,000",,Owner,,,"Between $4,000 and $120,000",3,2,0,Heating oil,5000,6,Less than once a week,car or motorbike,car or motorbike,car or motorbike,"Not so much, public transport is available but with many limitations",5,Never,Somewhat disagree,3,A problem,"Richer, for example thanks to technological progress",We should make our society as sustainable as possible to avoid irreversible damages,4,1,2,3,5,3.866,1001.444,1163.145,14,"I support the freedoms enumerated in the Bill of Rights, free public education through high school only which is funded by general tax revenues rather than by property taxes, private enterprise with just enough government regulation to ensure honesty in business transactions, catastrophic healthcare for all, private property, elimination of wasteful government spending at all levels, replacement  of pensions for all government employees with a 401(k) type program with a 3% employer match, conversion of defunct shopping malls into housing for the elderly, removal of military forces from foreign countries.",3.992,374.012,385.226,5,"Rising levels of carbon dioxide in the air contribute to rising global temperatures.  A carbon tax is a political means of reducing carbon emissions which can not solve the problem but will result in significant financial returns to those who are favored by the politicians, especially the large campaign contributors.",4.75,759.94,768.943,5,"Energy use is the major human contributor to global warming and must be decreased by increasing the tax on energy production of all kinds, coal, petroleum, natural gas, wind, solar, hydroelectric, and nuclear.",is mainly due to human activity,"temperatures will continue to rise, just more slowly",Eating one beef steak emits far more greenhouse gases than eating two servings of pasta,,,Each of us,,,Companies,,Some foreign countries,,,3,2,5,4,1,6,7,8,"We should stop emissions, but unfortunately this is not going to happen.",5,1,2,3,4,6,Several times a year,,"People born in the 1990s (i.e., those currently between 20 and 30 years old)",People born in the 2020s,People born in the 2050s,,,No,,,,,,,I have already adopted a sustainable lifestyle,,,"... would be an opportunity for our economy: it would create jobs, reduce air pollution, and improve our lifestyle","... would be costly, but we would be able to maintain our lifestyle (e.g. increasing thermal insulation of housing, replacing cars running on fossil fuels by electric cars, electricity from coal by renewables or nuclear, etc.)","... would require a deep change in our lifestyle (e.g. reducing energy consumption, eating much less meat, driving less and using public transport or cycling instead, etc.)",,"The use of technologies that emit greenhouse gases (e.g. cars running on fossil fuels, electricity from coal...)","The level of waste (waste of energy, waste of food, inefficiencies, etc.)",,Overconsumption,,,,,,16.553,272.455,275.343,16,Local,State,Federal,Global,,Strongly disagree,Strongly agree,Strongly disagree,Strongly disagree,Strongly disagree,"No, we should not restrict greenhouse gas emissions",It depends: only if it is part of a fair international agreement,The US should take even more ambitious measures if other countries are less ambitious,No,No,No,0,0,155.868,0,0,0,284.692,0,No,No,No,No notable impact,No notable side effects,Would not be severely affected,Would lose,Would not be severely affected,Would win,Would not be severely affected,Be unaffected,No,No,"Don't know, or prefer not to say",Positive impacts,"Don't know, or prefer not to say",Would not be severely affected,Would lose,Would not be severely affected,Would win,Would lose,Be unaffected,No,30.376,109.761,112.097,11,No,No,Negative impacts,No notable side effects,Would lose,Would lose,Would not be severely affected,Would win,Would lose,Be unaffected,No,34.304,195.665,197.804,17,Not worried,"No, not at all","Yes, absolutely","No, not at all","Yes, absolutely","No, not at all","No, not at all",2,6,4,1,5,3,Strongly oppose,Strongly oppose,Strongly oppose,Strongly oppose,Rather support,Strongly oppose,Indifferent,Strongly oppose,Strongly support,Indifferent,,3,4,6,7,5,1,2,9,10,8,Voluntary: an owner should be able to not renovate their house,"Don't know, or prefer not to say",,,,,,,"Don't know, or prefer not to say",2,1,3,4,5,"Governments should only encourage people to protect the environment, even if it means people do not always do the right thing",$ 0 per year,A little,No,No,,,Center,,,,,,,,,,,,"Print media (e.g., print newspapers, magazines etc.)",Yes,Other,None,"Yes, biased towards environmental causes","Questions should have included a ""none of the above"" option.",EN,1,,4802,"1",1,1,3,,2,,1,4
2021-01-05 10:00:48,2021-01-05 12:51:20,IP Address,69.23.97.204,100,10232,True,2021-01-05 12:51:20,,,,,44.2433013916015625,-88.3563995361328125,anonymous,EN,Male,69,Midwest,54130,"A small town (between 5,000 and 20,000 inhabitants)",White,,,,,,,,,Native,College degree,Retired,No,"between $35,000 and $70,000",,Owner,,,"More than $380,000",1,2,0,Gas,12000,2,One to four times per week,car or motorbike,car or motorbike,car or motorbike,"Not so much, public transport is available but with many limitations",2,Only some of the time,Strongly disagree,2,A serious problem,"Poorer, for example due to resource depletion and/or climate change",Our civilization will develop so much that environmental issues will not be a problem in the distant future,3,4,2,1,5,4.262,4.262,15.992,1,Conservative,4.229,4.229,59.729,1,it is real.  whether it has been man-made -- or that man can ultimately make any significant change in the process -- is seriously in question,3.448,3.448,47.009,1,should help do whatever might be appropriate to facilitate (NOT fund) technological advancement,is mainly due to natural climate variability,"temperatures will continue to rise, just more slowly",Eating one beef steak emits far more greenhouse gases than eating two servings of pasta,Electricity produced by nuclear power emits far more greenhouse gases than electricity produced by wind turbines,,Each of us,The rich,,,,,Natural causes,,4,2,7,6,3,5,1,8,"We should stop emissions, but unfortunately this is not going to happen.",3,1,4,2,5,6,Almost never,,,People born in the 2020s,,,,Yes,,,"Yes, if everyone did the same",,,,,,,,,"... would require a deep change in our lifestyle (e.g. reducing energy consumption, eating much less meat, driving less and using public transport or cycling instead, etc.)",,"The use of technologies that emit greenhouse gases (e.g. cars running on fossil fuels, electricity from coal...)","The level of waste (waste of energy, waste of food, inefficiencies, etc.)",,,,,,,,8.319,159.549,162.253,14,,,,Global,,Neither agree nor disagree,Somewhat agree,Strongly disagree,Strongly disagree,Strongly disagree,"No, those who currently pollute more should have more rights to pollute",It depends: only if it is part of a fair international agreement,The US should take even more ambitious measures if other countries also take similar measures,"Don't know, or prefer not to say",No,No,,,,,0,0,8382.311,0,Yes,No,"Don't know, or prefer not to say",Negative impacts,Positive side effects,Would lose,Would lose,Would win,Would win,Would lose,Be unaffected,Yes,No,"Don't know, or prefer not to say",No notable impact,Positive side effects,Would lose,Would not be severely affected,Would win,Would win,Would not be severely affected,Be unaffected,Yes,30.495,83.519,85.141,11,No,No,Negative impacts,Negative side effects,Would lose,Would lose,Would win,Would lose,Would lose,Lose,No,8.948,283.618,285.028,20,Worried,Indifferent,"No, not really","Yes, somewhat",Indifferent,"Yes, somewhat","No, not really",6,4,2,1,5,3,Rather oppose,Rather oppose,Rather oppose,Indifferent,Indifferent,Rather oppose,Rather support,Strongly support,Strongly support,Strongly oppose,Gov't funding of new companies,7,4,1,2,3,5,6,9,10,8,Voluntary: an owner should be able to not renovate their house,,,"Don't know, or prefer not to say",,,The removal of subsidies for cattle farming,,,4,2,3,1,5,"Governments should only encourage people to protect the environment, even if it means people do not always do the right thing",$ 200 per year,A lot,No,No,,,,,,,Conservative,,Patriot,,,,Other (please specify):,Capitalist,Radio,Yes,Trump,,"No, I do not feel it was biased","I checked 'NO' on the biased question because it wasn't a totally one-way-or-the-other situation, but, yes it did lean a little towards the environmental causes side",EN,1,,10232,,1,0,3,2,,,1,4
2021-01-05 12:26:07,2021-01-05 12:54:13,IP Address,71.50.47.196,100,1685,True,2021-01-05 12:54:13,,,,,40.2389068603515625,-77.1934967041015625,anonymous,EN,Male,77,Northeast,16841,A rural area,White,,,,,,,,,Native,Master's degree or above,Self-employed,No,"between $70,000 and $120,000",,Owner,,,"More than $380,000",2,2,0,Heating oil,40000,6,Less than once a week,car or motorbike,car or motorbike,public transport,"No, there is no public transport",9,Only some of the time,Somewhat agree,4,A very serious problem,"Poorer, for example due to resource depletion and/or climate change",We should make our society as sustainable as possible to avoid irreversible damages,2,1,4,3,5,2.617,2.617,96.862,1,"I support rule of law elections.  I do not like coup attempts as the Donald is trying to do. 
I believe the government should help people.
I do not like racism.",4.421,105.904,124.064,4,We are fast running out of time to stop irreversible climate change.  It is like the Republicans have their head in the sand.  Their goals only extend until tomorrow's Dow Jones Index reading.,4.806,85.741,90.322,3,YES.  By supporting solar and wind energy big time. reducing dependence on carbon based fuels.,is mainly due to human activity,"temperatures will continue to rise, just more slowly",Eating one beef steak emits far more greenhouse gases than eating two servings of pasta,,Commuting by car emits far more greenhouse gases than food waste,Each of us,,,,,,,,5,6,7,3,2,1,4,8,Ambitious policies and raising awareness will eventually succeed in stopping emissions within the next century.,3,4,2,5,1,6,Several times a month,,"People born in the 1990s (i.e., those currently between 20 and 30 years old)",People born in the 2020s,People born in the 2050s,,,Yes,"Yes, if policies went in this direction",,"Yes, if everyone did the same",,,,,,,"... would be an opportunity for our economy: it would create jobs, reduce air pollution, and improve our lifestyle","... would be costly, but we would be able to maintain our lifestyle (e.g. increasing thermal insulation of housing, replacing cars running on fossil fuels by electric cars, electricity from coal by renewables or nuclear, etc.)","... would require a deep change in our lifestyle (e.g. reducing energy consumption, eating much less meat, driving less and using public transport or cycling instead, etc.)",,"The use of technologies that emit greenhouse gases (e.g. cars running on fossil fuels, electricity from coal...)","The level of waste (waste of energy, waste of food, inefficiencies, etc.)",,,Overpopulation,,,,,10.677,132.367,134.662,12,,,,Global,,Somewhat agree,Somewhat agree,Neither agree nor disagree,Somewhat agree,Somewhat agree,"Yes, this would be a fair solution",Yes,The US should take even more ambitious measures if other countries are less ambitious,Yes,"Don't know, or prefer not to say","Don't know, or prefer not to say",,,,,,,,,No,Yes,Yes,Positive impacts,Positive side effects,Would not be severely affected,Would not be severely affected,Would win,Would win,Would not be severely affected,Be unaffected,Yes,Yes,Yes,Positive impacts,Positive side effects,Would not be severely affected,Would win,Would win,Would win,Would not be severely affected,Be unaffected,Yes,26.507,76.699,79.128,11,Yes,Yes,Positive impacts,Positive side effects,Would not be severely affected,Would not be severely affected,Would win,Would win,Would not be severely affected,Be unaffected,Yes,5.909,112.994,122.696,18,Worried,"Yes, somewhat","Yes, absolutely","Yes, somewhat","Yes, absolutely","Yes, absolutely","Yes, somewhat",3,6,1,2,5,4,Rather oppose,Rather support,Indifferent,Rather oppose,Rather support,Rather support,Indifferent,Rather oppose,Indifferent,Indifferent,Unknown,3,1,6,4,2,5,7,9,10,8,Mandatory: every building should be renovated before a certain date,,,Those who plan to not fly within a two-year period would be allowed to sell their “right to fly” to someone who wants to fly more than once during these two years.,"A high tax on cattle products, so that the price of beef doubles",,The removal of subsidies for cattle farming,,,2,4,1,3,5,"Governments should force people to protect the environment, even if it prevents people from doing what they want",$ 1500 per year,A lot,No,Yes,,Left or center-left,,,,,,,Patriot,,,,,,News websites (e.g. online newspapers),Yes,Biden,,"No, I do not feel it was biased",,EN,1,,1685,"2",0,0,3,2,,,1,4
2021-01-05 13:01:26,2021-01-05 13:02:49,IP Address,68.84.113.188,100,83,True,2021-01-05 13:02:49,,,,,39.7458038330078125,-75.58100128173828125,anonymous,EN,Male,5,Northeast,19720,"A small city (between 50,000 and 250,000 inhabitants)",White,,,,,,,,,Native,High school,Retired,No,"less than $35,000",Tenant,,,,"Between $4,000 and $120,000",,,,,,,,,,,,,,,,,,,,,,,,,,,,,,,,,,,,,,,,,,,,,,,,,,,,,,,,,,,,,,,,,,,,,,,,,,,,,,,,,,,,,,,,,,,,,,,,,,,,,,,,,,,,,,,,,,,,,,,,,,,,,,,,,,,,,,,,,,,,,,,,,,,,,,,,,,,,,,,,,,,,,,,,,,,,,,,,,,,,,,,,,,,,,,,,,,,,,,,,,,,,,,,,,,,,,,,,,,,,,,,,,,,,,,,,,,,,,,,,EN,1,QuotaMet,83,,,,,,,,,
